[
  {
    "id": "LIP001",
    "name": "Velvet Matte Lipstick",
    "slug": "velvet-matte-lipstick",
    "images": ["/assets/img/products/lipstick.jpeg"],
    "price": 19.99,
    "currency": "PKR",
    "categories": ["makeup", "lipsticks"],
    "brand": "4D Cosmetics",
    "tags": ["matte", "long-wear"],
    "shortDescription": "Rich color with a creamy matte finish.",
    "descriptionHTML": "<p>Rich color with a creamy matte finish.</p>",
    "inStock": true,
    "sku": "LIP001",
    "variants": [
      {
        "id": "LIP001-ROSE01",
        "name": "Rose 01",
        "color": "#C07082",
        "image": "/assets/img/products/lipstick.jpeg",
        "price": 19.99,
        "inStock": true,
        "sku": "LIP001-ROSE01"
      },
      {
        "id": "LIP001-CORAL02",
        "name": "Coral 02",
        "color": "#E86C5D",
        "image": "/assets/img/products/lipstick.jpeg",
        "price": 19.99,
        "inStock": true,
        "sku": "LIP001-CORAL02"
      },
      {
        "id": "LIP001-BERRY03",
        "name": "Berry 03",
        "color": "#8B3F64",
        "image": "/assets/img/products/lipstick.jpeg",
        "price": 19.99,
        "inStock": false,
        "sku": "LIP001-BERRY03"
      }
    ],
    "details": ["Rich color", "Creamy matte finish", "Long-lasting"],
    "howTo": ["Apply to lips", "Layer for intensity"],
    "ingredients": "Ricinus Communis (Castor) Seed Oil, Caprylic/Capric Triglyceride, etc.",
    "goodToKnow": "Vegan and cruelty-free",
    "shippingReturns": "Ships in 3-5 days. 30-day returns."
  },
  {
    "id": "FND001",
    "name": "Hydrating Foundation",
    "slug": "hydrating-foundation",
    "images": ["/assets/img/products/foundation.jpeg"],
    "price": 29.99,
    "currency": "PKR",
    "categories": ["makeup", "foundation"],
    "brand": "4D Cosmetics",
    "tags": ["lightweight"],
    "shortDescription": "Lightweight foundation for a natural glow.",
    "descriptionHTML": "<p>Lightweight foundation for a natural glow.</p>",
    "inStock": true,
    "sku": "FND001"
  },
  {
    "id": "SER001",
    "name": "Vitamin C Serum",
    "slug": "vitamin-c-serum",
    "images": ["/assets/img/products/serum.jpeg"],
    "price": 24.99,
    "currency": "PKR",
    "categories": ["skin-care", "serums"],
    "brand": "4D Cosmetics",
    "tags": ["antioxidant"],
    "shortDescription": "Brightens skin with powerful antioxidants.",
    "descriptionHTML": "<p>Brightens skin with powerful antioxidants.</p>",
    "inStock": true,
    "sku": "SER001"
  },
  {
    "id": "CRM001",
    "name": "Moisturizing Cream",
    "slug": "moisturizing-cream",
    "images": ["/assets/img/products/cream.jpeg"],
    "price": 34.99,
    "currency": "PKR",
    "categories": ["skin-care", "creams"],
    "brand": "4D Cosmetics",
    "tags": ["hydrating"],
    "shortDescription": "Hydrates deeply for smooth, soft skin.",
    "descriptionHTML": "<p>Hydrates deeply for smooth, soft skin.</p>",
    "inStock": true,
    "sku": "CRM001"
  },
  {
    "id": "PRF001",
    "name": "Blossom Perfume",
    "slug": "blossom-perfume",
    "images": ["/assets/img/products/perfume.jpeg"],
    "price": 39.99,
    "currency": "PKR",
    "categories": ["fragrance", "perfume"],
    "brand": "4D Cosmetics",
    "tags": ["floral"],
    "shortDescription": "Floral fragrance with fresh notes.",
    "descriptionHTML": "<p>Floral fragrance with fresh notes.</p>",
    "inStock": false,
    "sku": "PRF001"
  },
  {
    "id": "PRM001",
    "name": "RBory Face Primer",
    "slug": "rbory-face-primer",
    "images": ["/assets/img/products/Rbory-Face-Primer-30ml.jpg"],
    "price": 2500,
    "currency": "PKR",
    "categories": ["makeup", "primer"],
    "brand": "RBory",
    "tags": ["non-greasy"],
    "shortDescription": "Lightweight non-greasy face primer keeps makeup fresh all day.",
    "descriptionHTML": "<p>Lightweight non greesy face Primer, Makeup Fresh &amp; flawless all day long</p>",
    "inStock": true,
    "sku": "PRM001"
  },
  {
    "id": "LIP002",
    "name": "Art skin Velvet Lipstick 6 Pcs",
    "slug": "art-skin-velvet-lipstick-6-pcs",
    "images": ["/assets/img/products/art-skin-velvet-lipstick.jpg"],
    "price": 2000,
    "currency": "PKR",
    "categories": ["makeup", "lipsticks"],
    "brand": "Art Skin",
    "tags": ["set", "matte"],
    "shortDescription": "Velvety matte lipstick set for soft finish and all-day wear.",
    "descriptionHTML": "<p>Velvety Matte Lipstick with soft finish and All day Wear</p>",
    "inStock": true,
    "sku": "LIP002"
  }
]
